{
  "format": "teasescript-work-package",
  "version": 1,
  "id": "WP-ISSUE-123-v1",
  "title": "Implement issue 123",
  "repository": "TeaseScript-AI/teasescript-platform",
  "targetBranch": "fix/issue-123",
  "baseSha": "0000000000000000000000000000000000000000",
  "basePolicy": "exact",
  "requiredContext": [
    "AGENTS.md",
    "tools/work-packages/README.md"
  ],
  "allowedPaths": [
    "src/example.ts",
    "tests/example.test.ts"
  ],
  "baseBlobs": {
    "src/example.ts": "1111111111111111111111111111111111111111",
    "tests/example.test.ts": null
  },
  "checks": [
    {
      "id": "build",
      "argv": [
        "npm",
        "run",
        "build"
      ]
    },
    {
      "id": "full-check",
      "argv": [
        "npm",
        "run",
        "check"
      ]
    }
  ],
  "commit": {
    "subject": "Implement issue 123",
    "body": [
      "add the focused implementation",
      "cover the behavior with regression tests"
    ]
  }
}
